<xs:schema xmlns:xs="http://www.w3.org/2001/XMLSchema">
    <xs:element name="book">
        <xs:complexType>
            <xs:sequence>
                <xs:element name="id" type="xs:string" />
                <xs:element name="name" type="xs:string" />
                <xs:element name="noofpages" type="xs:integer" />
                <xs:element name="author" type="xs:string" />
                <xs:element name="price" type="xs:float" />
            </xs:sequence>
        </xs:complexType>
    </xs:element>
</xs:schema>